position,country,score_total,executive_summary,sources_count,score_estabilidad_economica,score_riesgo_comercial,score_riesgo_politico
1,Marruecos,21.0,"Marruecos presenta un contexto político y económico complejo, con una estabilidad política que depende de factores como la hegemonía militar española y la gobernanza del país. La economía marroquí muestra un crecimiento económico con variaciones anuales significativas, y un sector industrial en desarrollo. La inversión en Marruecos puede ser atractiva debido a su ubicación geográfica y su potencial para la exportación.",12,8.0,5.0,4.0
2,Vietnam,21.0,"Vietnam ha demostrado una gran resiliencia en la gestión de la pandemia y ha mantenido un crecimiento económico alto. Sin embargo, el país enfrenta desafíos como la contracción económica en el tercer trimestre del año pasado y la necesidad de una respuesta proactiva ante las nuevas evoluciones mundiales. El gobierno de Vietnam ha implementado nuevos procesos para endurecer las regulaciones fiscales y de importación.",12,7.0,4.0,4.0
3,México,18.0,"México presenta un panorama económico y político complejo, con un crecimiento económico lento y una inflación controlada. La estabilidad política es fundamental para atraer inversión y mejorar la productividad. El país ofrece oportunidades de exportación y comercio exterior, especialmente en sectores como la manufactura y la logística.",12,6.0,6.0,4.0
4,Colombia,15.0,"Colombia enfrenta desafíos políticos y económicos, incluyendo una crisis de gobernabilidad y una economía con un crecimiento lento. Sin embargo, el país también ofrece oportunidades de inversión en sectores como la manufactura y el comercio exterior. La situación regulatoria es compleja, con aranceles de exportación y requisitos legales que deben ser considerados.",12,7.0,5.0,9.0
5,Turquía,15.0,"Turquía presenta un contexto político complejo con un retorno a la ortodoxia económica en 2023, lo que ha logrado contener la inflación pero ha frenado la demanda interna. El país tiene un crecimiento económico reciente y una posición geográfica estratégica. Sin embargo, existen riesgos políticos y regulatorios que deben ser considerados.",12,7.0,7.0,7.0
